indicator_id,indicator,unit,indicator_desc,source_org,
IQ.SCI.OVRL,Statistical Capacity score (Overall average),NA,"The Statistical Capacity Indicator is a composite score assessing the capacity of a country’s statistical system. It is based on a diagnostic framework assessing the following areas: methodology; data sources; and periodicity and timeliness. Countries are scored against 25 criteria in these areas, using publicly available information and/or country input. The overall Statistical Capacity score is then calculated as a simple average of all three area scores on a scale of 0-100.","World Bank, Bulletin Board on Statistical Capacity (http://bbsc.worldbank.org).",
IQ.SCI.PRDC,Periodicity and timeliness assessment of statistical capacity (scale 0 - 100),NA,The periodicity and timeliness indicator assesses the availability and periodicity of key socioeconomic indicators. It measures the extent to which data are made accessible to users through transformation of source data into timely statistical outputs. The periodicity score is calculated as the weighted average of 10 underlying indicator scores. The final periodicity score contributes 1/3 of the overall Statistical Capacity Indicator score.,"World Bank, Bulletin Board on Statistical Capacity (http://bbsc.worldbank.org).",
IQ.SCI.SRCE,Source data assessment of statistical capacity (scale 0 - 100),NA,"The source data indicator reflects whether a country conducts data collection activities in line with internationally recommended periodicity, and whether data from administrative systems are available. The source data score is calculated as the weighted average of 5 underlying indicator scores. The final source data score contributes 1/3 of the overall Statistical Capacity Indicator score.","World Bank, Bulletin Board on Statistical Capacity (http://bbsc.worldbank.org).",
IS.RRS.TOTL.KM,Rail lines (total route-km),NA,"Rail lines are the length of railway route available for train service, irrespective of the number of parallel tracks.",Internation Union of Railways (UIC),
MS.MIL.XPND.CD,Military expenditure (current USD),NA,"Military expenditures data from SIPRI are derived from the NATO definition, which includes all current and capital expenditures on the armed forces, including peacekeeping forces; defense ministries and other government agencies engaged in defense projects; paramilitary forces, if these are judged to be trained and equipped for military operations; and military space activities. Such expenditures include military and civil personnel, including retirement pensions of military personnel and social services for personnel; operation and maintenance; procurement; military research and development; and military aid (in the military expenditures of the donor country). Excluded are civil defense and current expenditures for previous military activities, such as for veterans' benefits, demobilization, conversion, and destruction of weapons. This definition cannot be applied for all countries, however, since that would require much more detailed information than is available about what is included in military budgets and off-budget military expenditure items. (For example, military budgets might or might not cover civil defense, reserves and auxiliary forces, police and paramilitary forces, dual-purpose forces such as military and civilian police, military grants in kind, pensions for military personnel, and social security contributions paid by one part of government to another).","Stockholm International Peace Research Institute (SIPRI), Yearbook: Armaments, Disarmament and International Security.",
MS.MIL.XPND.GD.ZS,Military expenditure (% of GDP),NA,"Military expenditures data from SIPRI are derived from the NATO definition, which includes all current and capital expenditures on the armed forces, including peacekeeping forces; defense ministries and other government agencies engaged in defense projects; paramilitary forces, if these are judged to be trained and equipped for military operations; and military space activities. Such expenditures include military and civil personnel, including retirement pensions of military personnel and social services for personnel; operation and maintenance; procurement; military research and development; and military aid (in the military expenditures of the donor country). Excluded are civil defense and current expenditures for previous military activities, such as for veterans' benefits, demobilization, conversion, and destruction of weapons. This definition cannot be applied for all countries, however, since that would require much more detailed information than is available about what is included in military budgets and off-budget military expenditure items. (For example, military budgets might or might not cover civil defense, reserves and auxiliary forces, police and paramilitary forces, dual-purpose forces such as military and civilian police, military grants in kind, pensions for military personnel, and social security contributions paid by one part of government to another.)","Stockholm International Peace Research Institute (SIPRI), Yearbook: Armaments, Disarmament and International Security.",
MS.MIL.XPND.ZS,Military expenditure (% of general government expenditure),NA,"Military expenditures data from SIPRI are derived from the NATO definition, which includes all current and capital expenditures on the armed forces, including peacekeeping forces; defense ministries and other government agencies engaged in defense projects; paramilitary forces, if these are judged to be trained and equipped for military operations; and military space activities. Such expenditures include military and civil personnel, including retirement pensions of military personnel and social services for personnel; operation and maintenance; procurement; military research and development; and military aid (in the military expenditures of the donor country). Excluded are civil defense and current expenditures for previous military activities, such as for veterans' benefits, demobilization, conversion, and destruction of weapons. This definition cannot be applied for all countries, however, since that would require much more detailed information than is available about what is included in military budgets and off-budget military expenditure items. (For example, military budgets might or might not cover civil defense, reserves and auxiliary forces, police and paramilitary forces, dual-purpose forces such as military and civilian police, military grants in kind, pensions for military personnel, and social security contributions paid by one part of government to another.)","Stockholm International Peace Research Institute (SIPRI), Yearbook: Armaments, Disarmament and International Security.",
NY.ADJ.AEDU.CD,Adjusted savings: education expenditure (current US$),NA,"Education expenditure refers to the current operating expenditures in education, including wages and salaries and excluding capital investments in buildings and equipment.",UNESCO, data are extrapolated to the most recent year available
NY.ADJ.AEDU.GN.ZS,Adjusted savings: education expenditure (% of GNI),NA,"Education expenditure refers to the current operating expenditures in education, including wages and salaries and excluding capital investments in buildings and equipment.",UNESCO, data are extrapolated to the most recent year available
NY.ADJ.DKAP.CD,Adjusted savings: consumption of fixed capital (current US$),NA,Consumption of fixed capital represents the replacement value of capital used up in the process of production.,World Bank staff estimates based on sources and methods described in the World Bank's The Changing Wealth of Nations.,
NY.ADJ.DKAP.GN.ZS,Adjusted savings: consumption of fixed capital (% of GNI),NA,Consumption of fixed capital represents the replacement value of capital used up in the process of production.,World Bank staff estimates based on sources and methods described in the World Bank's The Changing Wealth of Nations.,
NY.ADJ.ICTR.GN.ZS,Adjusted savings: gross savings (% of GNI),NA,"Gross savings are the difference between gross national income and public and private consumption, plus net current transfers.",World Bank national accounts data files.,
NY.ADJ.NNAT.CD,Adjusted savings: net national savings (current US$),NA,Net national savings are equal to gross national savings less the value of consumption of fixed capital.,World Bank staff estimates based on sources and methods described in the World Bank's The Changing Wealth of Nations.,
NY.ADJ.NNAT.GN.ZS,Adjusted savings: net national savings (% of GNI),NA,Net national savings are equal to gross national savings less the value of consumption of fixed capital.,World Bank staff estimates based on sources and methods described in the World Bank's The Changing Wealth of Nations.,
NY.ADJ.NNTY.KD,Adjusted net national income (constant 2010 US$),NA,Adjusted net national income is GNI minus consumption of fixed capital and natural resources depletion.,World Bank staff estimates based on sources and methods described in the World Bank's The Changing Wealth of Nations.,
NY.ADJ.NNTY.KD.ZG,Adjusted net national income (annual % growth),NA,Adjusted net national income is GNI minus consumption of fixed capital and natural resources depletion.,World Bank staff estimates based on sources and methods described in the World Bank's The Changing Wealth of Nations.,
NY.GDP.DEFL.KD.ZG,"Inflation, GDP deflator (annual %)",NA,Inflation as measured by the annual growth rate of the GDP implicit deflator shows the rate of price change in the economy as a whole. The GDP implicit deflator is the ratio of GDP in current local currency to GDP in constant local currency.,"World Bank national accounts data, and OECD National Accounts data files.",
NY.GDP.MKTP.KD,GDP (constant 2010 US$),NA,"GDP at purchaser's prices is the sum of gross value added by all resident producers in the economy plus any product taxes and minus any subsidies not included in the value of the products. It is calculated without making deductions for depreciation of fabricated assets or for depletion and degradation of natural resources. Data are in constant 2010 U.S. dollars. Dollar figures for GDP are converted from domestic currencies using 2010 official exchange rates. For a few countries where the official exchange rate does not reflect the rate effectively applied to actual foreign exchange transactions, an alternative conversion factor is used.","World Bank national accounts data, and OECD National Accounts data files.",
NY.GDP.MKTP.KD.ZG,GDP growth (annual %),NA,Annual percentage growth rate of GDP at market prices based on constant local currency. Aggregates are based on constant 2010 U.S. dollars. GDP is the sum of gross value added by all resident producers in the economy plus any product taxes and minus any subsidies not included in the value of the products. It is calculated without making deductions for depreciation of fabricated assets or for depletion and degradation of natural resources.,"World Bank national accounts data, and OECD National Accounts data files.",
NY.GDP.MKTP.PP.KD,"GDP, PPP (constant 2017 international $)",NA,PPP GDP is gross domestic product converted to international dollars using purchasing power parity rates. An international dollar has the same purchasing power over GDP as the U.S. dollar has in the United States. GDP is the sum of gross value added by all resident producers in the country plus any product taxes and minus any subsidies not included in the value of the products. It is calculated without making deductions for depreciation of fabricated assets or for depletion and degradation of natural resources. Data are in constant 2017 international dollars.,"International Comparison Program, World Bank | World Development Indicators database, World Bank | Eurostat-OECD PPP Programme.",
NY.GDP.PCAP.KD,GDP per capita (constant 2010 US$),NA,GDP per capita is gross domestic product divided by midyear population. GDP is the sum of gross value added by all resident producers in the economy plus any product taxes and minus any subsidies not included in the value of the products. It is calculated without making deductions for depreciation of fabricated assets or for depletion and degradation of natural resources. Data are in constant 2010 U.S. dollars.,"World Bank national accounts data, and OECD National Accounts data files.",
NY.GDP.PCAP.PP.KD,"GDP per capita, PPP (constant 2017 international $)",NA,GDP per capita based on purchasing power parity (PPP). PPP GDP is gross domestic product converted to international dollars using purchasing power parity rates. An international dollar has the same purchasing power over GDP as the U.S. dollar has in the United States. GDP at purchaser's prices is the sum of gross value added by all resident producers in the country plus any product taxes and minus any subsidies not included in the value of the products. It is calculated without making deductions for depreciation of fabricated assets or for depletion and degradation of natural resources. Data are in constant 2017 international dollars.,"International Comparison Program, World Bank | World Development Indicators database, World Bank | Eurostat-OECD PPP Programme.",
NY.GDS.TOTL.ZS,Gross domestic savings (% of GDP),NA,Gross domestic savings are calculated as GDP less final consumption expenditure (total consumption).,"World Bank national accounts data, and OECD National Accounts data files.",
NY.GDY.TOTL.KN,Gross domestic income (constant LCU),NA,Gross domestic income is derived as the sum of GDP and the terms of trade adjustment. Data are in constant local currency.,"World Bank national accounts data, and OECD National Accounts data files.",
NY.GNP.PCAP.KD,GNI per capita (constant 2010 US$),NA,GNI per capita is gross national income divided by midyear population. GNI (formerly GNP) is the sum of value added by all resident producers plus any product taxes (less subsidies) not included in the valuation of output plus net receipts of primary income (compensation of employees and property income) from abroad. Data are in constant 2010 U.S. dollars.,"World Bank national accounts data, and OECD National Accounts data files.",
NY.GNP.PCAP.KD.ZG,GNI per capita growth (annual %),NA,Annual percentage growth rate of GNI per capita based on constant local currency. Aggregates are based on constant 2010 U.S. dollars. GNI per capita is gross national income divided by midyear population. GNI (formerly GNP) is the sum of value added by all resident producers plus any product taxes (less subsidies) not included in the valuation of output plus net receipts of primary income (compensation of employees and property income) from abroad.,"World Bank national accounts data, and OECD National Accounts data files.",
NY.GNP.PCAP.PP.KD,"GNI per capita, PPP (constant 2017 international $)",NA,GNI per capita based on purchasing power parity (PPP). PPP GNI is gross national income (GNI) converted to international dollars using purchasing power parity rates. An international dollar has the same purchasing power over GNI as a U.S. dollar has in the United States. GNI is the sum of value added by all resident producers plus any product taxes (less subsidies) not included in the valuation of output plus net receipts of primary income (compensation of employees and property income) from abroad. Data are in constant 2017 international dollars.,"International Comparison Program, World Bank | World Development Indicators database, World Bank | Eurostat-OECD PPP Programme.",
per_allsp.adq_pop_tot,Adequacy of social protection and labor programs (% of total welfare of beneficiary households),NA,"Adequacy of social protection and labor programs (SPL) is measured by the total transfer amount received by the population participating in social insurance, social safety net, and unemployment benefits and active labor market programs as a share of their total welfare. Welfare is defined as the total income or total expenditure of beneficiary households. Estimates include both direct and indirect beneficiaries.","ASPIRE: The Atlas of Social Protection - Indicators of Resilience and Equity, The World Bank. Data are based on national representative household surveys. (datatopics.worldbank.org/aspire/)",
per_allsp.ben_q1_tot,Benefit incidence of social protection and labor programs to poorest quintile (% of total SPL benefits),NA,"Benefit incidence of social protection and labor programs (SPL) to poorest quintile shows the percentage of total social protection and labor programs benefits received by the poorest 20% of the population. Social protection and labor programs include social insurance, social safety nets, and unemployment benefits and active labor market programs. Estimates include both direct and indirect beneficiaries.","ASPIRE: The Atlas of Social Protection - Indicators of Resilience and Equity, The World Bank. Data are based on national representative household surveys. (datatopics.worldbank.org/aspire/)",
per_allsp.cov_pop_tot,Coverage of social protection and labor programs (% of population),NA,"Coverage of social protection and labor programs (SPL) shows the percentage of population participating in social insurance, social safety net, and unemployment benefits and active labor market programs. Estimates include both direct and indirect beneficiaries.","ASPIRE: The Atlas of Social Protection - Indicators of Resilience and Equity, The World Bank. Data are based on national representative household surveys. (datatopics.worldbank.org/aspire/)",
per_lm_alllm.adq_pop_tot,Adequacy of unemployment benefits and ALMP (% of total welfare of beneficiary households),NA,"Adequacy of unemployment benefits and active labor market programs (ALMP) is measured by the total transfer amount received by the population participating in unemployment benefits and active labor market programs as a share of their total welfare. Welfare is defined as the total income or total expenditure of beneficiary households. Unemployment benefits and active labor market programs include unemployment compensation, severance pay, and early retirement due to labor market reasons, labor market services (intermediation), training (vocational, life skills, and cash for training), job rotation and job sharing, employment incentives and wage subsidies, supported employment and rehabilitation, and employment measures for the disabled. Estimates include both direct and indirect beneficiaries.","ASPIRE: The Atlas of Social Protection - Indicators of Resilience and Equity, The World Bank. Data are based on national representative household surveys. (datatopics.worldbank.org/aspire/)",
per_lm_alllm.ben_q1_tot,Benefit incidence of unemployment benefits and ALMP to poorest quintile (% of total U/ALMP benefits),NA,"Benefit incidence of unemployment benefits and active labor market programs (ALMP) to poorest quintile shows the percentage of total unemployment and active labor market programs benefits received by the poorest 20% of the population. Unemployment benefits and active labor market programs include unemployment compensation, severance pay, and early retirement due to labor market reasons, labor market services (intermediation), training (vocational, life skills, and cash for training), job rotation and job sharing, employment incentives and wage subsidies, supported employment and rehabilitation, and employment measures for the disabled. Estimates include both direct and indirect beneficiaries.","ASPIRE: The Atlas of Social Protection - Indicators of Resilience and Equity, The World Bank. Data are based on national representative household surveys. (datatopics.worldbank.org/aspire/)",
per_lm_alllm.cov_pop_tot,Coverage of unemployment benefits and ALMP (% of population),NA,"Coverage of unemployment benefits and active labor market programs (ALMP) shows the percentage of population participating in unemployment compensation, severance pay, and early retirement due to labor market reasons, labor market services (intermediation), training (vocational, life skills, and cash for training), job rotation and job sharing, employment incentives and wage subsidies, supported employment and rehabilitation, and employment measures for the disabled. Estimates include both direct and indirect beneficiaries.","ASPIRE: The Atlas of Social Protection - Indicators of Resilience and Equity, The World Bank. Data are based on national representative household surveys. (datatopics.worldbank.org/aspire/)",
per_lm_alllm.cov_q1_tot,Coverage of unemployment benefits and ALMP in poorest quintile (% of population),NA,"Coverage of unemployment benefits and active labor market programs (ALMP) shows the percentage of population participating in unemployment compensation, severance pay, and early retirement due to labor market reasons, labor market services (intermediation), training (vocational, life skills, and cash for training), job rotation and job sharing, employment incentives and wage subsidies, supported employment and rehabilitation, and employment measures for the disabled. Estimates include both direct and indirect beneficiaries.","ASPIRE: The Atlas of Social Protection - Indicators of Resilience and Equity, The World Bank. Data are based on national representative household surveys. (datatopics.worldbank.org/aspire/)",
per_lm_alllm.cov_q2_tot,Coverage of unemployment benefits and ALMP in 2nd quintile (% of population),NA,"Coverage of unemployment benefits and active labor market programs (ALMP) shows the percentage of population participating in unemployment compensation, severance pay, and early retirement due to labor market reasons, labor market services (intermediation), training (vocational, life skills, and cash for training), job rotation and job sharing, employment incentives and wage subsidies, supported employment and rehabilitation, and employment measures for the disabled. Estimates include both direct and indirect beneficiaries.","ASPIRE: The Atlas of Social Protection - Indicators of Resilience and Equity, The World Bank. Data are based on national representative household surveys. (datatopics.worldbank.org/aspire/)",
per_lm_alllm.cov_q3_tot,Coverage of unemployment benefits and ALMP in 3rd quintile (% of population),NA,"Coverage of unemployment benefits and active labor market programs (ALMP) shows the percentage of population participating in unemployment compensation, severance pay, and early retirement due to labor market reasons, labor market services (intermediation), training (vocational, life skills, and cash for training), job rotation and job sharing, employment incentives and wage subsidies, supported employment and rehabilitation, and employment measures for the disabled. Estimates include both direct and indirect beneficiaries.","ASPIRE: The Atlas of Social Protection - Indicators of Resilience and Equity, The World Bank. Data are based on national representative household surveys. (datatopics.worldbank.org/aspire/)",
per_lm_alllm.cov_q4_tot,Coverage of unemployment benefits and ALMP in 4th quintile (% of population),NA,"Coverage of unemployment benefits and active labor market programs (ALMP) shows the percentage of population participating in unemployment compensation, severance pay, and early retirement due to labor market reasons, labor market services (intermediation), training (vocational, life skills, and cash for training), job rotation and job sharing, employment incentives and wage subsidies, supported employment and rehabilitation, and employment measures for the disabled. Estimates include both direct and indirect beneficiaries.","ASPIRE: The Atlas of Social Protection - Indicators of Resilience and Equity, The World Bank. Data are based on national representative household surveys. (datatopics.worldbank.org/aspire/)",
per_lm_alllm.cov_q5_tot,Coverage of unemployment benefits and ALMP in richest quintile (% of population),NA,"Coverage of unemployment benefits and active labor market programs (ALMP) shows the percentage of population participating in unemployment compensation, severance pay, and early retirement due to labor market reasons, labor market services (intermediation), training (vocational, life skills, and cash for training), job rotation and job sharing, employment incentives and wage subsidies, supported employment and rehabilitation, and employment measures for the disabled. Estimates include both direct and indirect beneficiaries.","ASPIRE: The Atlas of Social Protection - Indicators of Resilience and Equity, The World Bank. Data are based on national representative household surveys. (datatopics.worldbank.org/aspire/)",
per_sa_allsa.adq_pop_tot,Adequacy of social safety net programs (% of total welfare of beneficiary households),NA,"Adequacy of social safety net programs is measured by the total transfer amount received by the population participating in social safety net programs as a share of their total welfare. Welfare is defined as the total income or total expenditure of beneficiary households. Social safety net programs include cash transfers and last resort programs, noncontributory social pensions, other cash transfers programs (child, family and orphan allowances, birth and death grants, disability benefits, and other allowances), conditional cash transfers, in-kind food transfers (food stamps and vouchers, food rations, supplementary feeding, and emergency food distribution), school feeding, other social assistance programs (housing allowances, scholarships, fee waivers, health subsidies, and other social assistance) and public works programs (cash for work and food for work). Estimates include both direct and indirect beneficiaries.","ASPIRE: The Atlas of Social Protection - Indicators of Resilience and Equity, The World Bank. Data are based on national representative household surveys. (datatopics.worldbank.org/aspire/)",
