indicator_id,indicator,unit,indicator_desc,source_org,
SH.MED.SAOP.P5,"Specialist surgical workforce (per 100,000 population)",NA,"Specialist surgical workforce is the number of specialist surgical, anaesthetic, and obstetric (SAO) providers who are working in each country per 100,000 population.","Data collected by the Lancet Commission on Global Surgery (www.lancetglobalsurgery.org); Data collected by WHO Collaborating Centre for Surgery and Public Health at Lund University from various sources including Ministries of Health or equivalent national regulatory bodies, national official entities such as medical councils, Eurostat, OECD, WHO Euro Health For All Database, WHO EURO Technical resources for health Database; BMJ Glob Health.",
SH.MMR.RISK.ZS,Lifetime risk of maternal death (%),NA,"Life time risk of maternal death is the probability that a 15-year-old female will die eventually from a maternal cause assuming that current levels of fertility and mortality (including maternal mortality) do not change in the future, taking into account competing causes of death.","WHO, UNICEF, UNFPA, World Bank Group, and the United Nations Population Division. Trends in Maternal Mortality: 2000 to 2017. Geneva, World Health Organization, 2019",
SH.STA.BASS.RU.ZS,"People using at least basic sanitation services, rural (% of rural population)",NA,"The percentage of people using at least basic sanitation services, that is, improved sanitation facilities that are not shared with other households.  This indicator encompasses both people using basic sanitation services as well as those using safely managed sanitation services.   Improved sanitation facilities include flush/pour flush to piped sewer systems, septic tanks or pit latrines; ventilated improved pit latrines, compositing toilets or pit latrines with slabs.","WHO/UNICEF Joint Monitoring Programme (JMP) for Water Supply, Sanitation and Hygiene (washdata.org).",
SH.STA.BASS.UR.ZS,"People using at least basic sanitation services, urban (% of urban population)",NA,"The percentage of people using at least basic sanitation services, that is, improved sanitation facilities that are not shared with other households.  This indicator encompasses both people using basic sanitation services as well as those using safely managed sanitation services.   Improved sanitation facilities include flush/pour flush to piped sewer systems, septic tanks or pit latrines; ventilated improved pit latrines, compositing toilets or pit latrines with slabs.","WHO/UNICEF Joint Monitoring Programme (JMP) for Water Supply, Sanitation and Hygiene (washdata.org).",
SH.STA.BASS.ZS,People using at least basic sanitation services (% of population),NA,"The percentage of people using at least basic sanitation services, that is, improved sanitation facilities that are not shared with other households.  This indicator encompasses both people using basic sanitation services as well as those using safely managed sanitation services.   Improved sanitation facilities include flush/pour flush to piped sewer systems, septic tanks or pit latrines; ventilated improved pit latrines, compositing toilets or pit latrines with slabs.","WHO/UNICEF Joint Monitoring Programme (JMP) for Water Supply, Sanitation and Hygiene (washdata.org).",
SH.XPD.CHEX.GD.ZS,Current health expenditure (% of GDP),NA,"Level of current health expenditure expressed as a percentage of GDP.  Estimates of current health expenditures include healthcare goods and services consumed during each year. This indicator does not include capital health expenditures such as buildings, machinery, IT and stocks of vaccines for emergency or outbreaks.",World Health Organization Global Health Expenditure database (http://apps.who.int/nha/database).,
SH.XPD.CHEX.PC.CD,Current health expenditure per capita (current US$),NA,Current expenditures on health per capita in current US dollars. Estimates of current health expenditures include healthcare goods and services consumed during each year.,World Health Organization Global Health Expenditure database (http://apps.who.int/nha/database).,
SI.DST.02ND.20,Income share held by second 20%,NA,Percentage share of income or consumption is the share that accrues to subgroups of population indicated by deciles or quintiles. Percentage shares by quintile may not sum to 100 because of rounding.,"World Bank, Development Research Group. Data are based on primary household survey data obtained from government statistical agencies and World Bank country departments. Data for high-income economies are from the Luxembourg Income Study database. For more information and methodology, please see PovcalNet (http://iresearch.worldbank.org/PovcalNet/index.htm).",
SI.DST.03RD.20,Income share held by third 20%,NA,Percentage share of income or consumption is the share that accrues to subgroups of population indicated by deciles or quintiles. Percentage shares by quintile may not sum to 100 because of rounding.,"World Bank, Development Research Group. Data are based on primary household survey data obtained from government statistical agencies and World Bank country departments. Data for high-income economies are from the Luxembourg Income Study database. For more information and methodology, please see PovcalNet (http://iresearch.worldbank.org/PovcalNet/index.htm).",
SI.DST.04TH.20,Income share held by fourth 20%,NA,Percentage share of income or consumption is the share that accrues to subgroups of population indicated by deciles or quintiles. Percentage shares by quintile may not sum to 100 because of rounding.,"World Bank, Development Research Group. Data are based on primary household survey data obtained from government statistical agencies and World Bank country departments. Data for high-income economies are from the Luxembourg Income Study database. For more information and methodology, please see PovcalNet (http://iresearch.worldbank.org/PovcalNet/index.htm).",
SI.DST.05TH.20,Income share held by highest 20%,NA,Percentage share of income or consumption is the share that accrues to subgroups of population indicated by deciles or quintiles. Percentage shares by quintile may not sum to 100 because of rounding.,"World Bank, Development Research Group. Data are based on primary household survey data obtained from government statistical agencies and World Bank country departments. Data for high-income economies are from the Luxembourg Income Study database. For more information and methodology, please see PovcalNet (http://iresearch.worldbank.org/PovcalNet/index.htm).",
SI.DST.10TH.10,Income share held by highest 10%,NA,Percentage share of income or consumption is the share that accrues to subgroups of population indicated by deciles or quintiles.,"World Bank, Development Research Group. Data are based on primary household survey data obtained from government statistical agencies and World Bank country departments. Data for high-income economies are from the Luxembourg Income Study database. For more information and methodology, please see PovcalNet (http://iresearch.worldbank.org/PovcalNet/index.htm).",
SI.DST.50MD,Proportion of people living below 50 percent of median income (%),NA,"The percentage of people in the population who live in households whose per capita income or consumption is below half of the median income or consumption per capita. The median is measured at 2011 Purchasing Power Parity (PPP) using PovcalNet (http://iresearch.worldbank.org/PovcalNet). For some countries, medians are not reported due to grouped and/or confidential data. The reference year is the year in which the underlying household survey data was collected. In cases for which the data collection period bridged two calendar years, the first year in which data were collected is reported.","World Bank, Development Research Group. Data are based on primary household survey data obtained from government statistical agencies and World Bank country departments. Data for high-income economies are from EU-SILC or the Luxembourg Income Study database. For more information and methodology, please see PovcalNet (iresearch.worldbank.org/PovcalNet/index.htm).",
SI.DST.FRST.10,Income share held by lowest 10%,NA,Percentage share of income or consumption is the share that accrues to subgroups of population indicated by deciles or quintiles.,"World Bank, Development Research Group. Data are based on primary household survey data obtained from government statistical agencies and World Bank country departments. Data for high-income economies are from the Luxembourg Income Study database. For more information and methodology, please see PovcalNet (http://iresearch.worldbank.org/PovcalNet/index.htm).",
SI.DST.FRST.20,Income share held by lowest 20%,NA,Percentage share of income or consumption is the share that accrues to subgroups of population indicated by deciles or quintiles. Percentage shares by quintile may not sum to 100 because of rounding.,"World Bank, Development Research Group. Data are based on primary household survey data obtained from government statistical agencies and World Bank country departments. Data for high-income economies are from the Luxembourg Income Study database. For more information and methodology, please see PovcalNet (http://iresearch.worldbank.org/PovcalNet/index.htm).",
SI.POV.DDAY,Poverty headcount ratio at $1.90 a day (2011 PPP) (% of population),NA,"Poverty headcount ratio at $1.90 a day is the percentage of the population living on less than $1.90 a day at 2011 international prices. As a result of revisions in PPP exchange rates, poverty rates for individual countries cannot be compared with poverty rates reported in earlier editions.","World Bank, Development Research Group. Data are based on primary household survey data obtained from government statistical agencies and World Bank country departments. Data for high-income economies are from the Luxembourg Income Study database. For more information and methodology, please see PovcalNet (http://iresearch.worldbank.org/PovcalNet/index.htm).",
SI.POV.GAPS,Poverty gap at $1.90 a day (2011 PPP) (%),NA,"Poverty gap at $1.90 a day (2011 PPP) is the mean shortfall in income or consumption from the poverty line $1.90 a day (counting the nonpoor as having zero shortfall), expressed as a percentage of the poverty line. This measure reflects the depth of poverty as well as its incidence. As a result of revisions in PPP exchange rates, poverty rates for individual countries cannot be compared with poverty rates reported in earlier editions.","World Bank, Development Research Group. Data are based on primary household survey data obtained from government statistical agencies and World Bank country departments. Data for high-income economies are from the Luxembourg Income Study database. For more information and methodology, please see PovcalNet (http://iresearch.worldbank.org/PovcalNet/index.htm).",
SI.POV.GINI,Gini index (World Bank estimate),NA,"Gini index measures the extent to which the distribution of income (or, in some cases, consumption expenditure) among individuals or households within an economy deviates from a perfectly equal distribution. A Lorenz curve plots the cumulative percentages of total income received against the cumulative number of recipients, starting with the poorest individual or household. The Gini index measures the area between the Lorenz curve and a hypothetical line of absolute equality, expressed as a percentage of the maximum area under the line. Thus a Gini index of 0 represents perfect equality, while an index of 100 implies perfect inequality.","World Bank, Development Research Group. Data are based on primary household survey data obtained from government statistical agencies and World Bank country departments. For more information and methodology, please see PovcalNet (http://iresearch.worldbank.org/PovcalNet/index.htm).",
SI.POV.LMIC,Poverty headcount ratio at $3.20 a day (2011 PPP) (% of population),NA,"Poverty headcount ratio at $3.20 a day is the percentage of the population living on less than $3.20 a day at 2011 international prices. As a result of revisions in PPP exchange rates, poverty rates for individual countries cannot be compared with poverty rates reported in earlier editions.","World Bank, Development Research Group. Data are based on primary household survey data obtained from government statistical agencies and World Bank country departments. Data for high-income economies are from the Luxembourg Income Study database. For more information and methodology, please see PovcalNet (http://iresearch.worldbank.org/PovcalNet/index.htm).",
SI.POV.LMIC.GP,Poverty gap at $3.20 a day (2011 PPP) (%),NA,"Poverty gap at $3.20 a day (2011 PPP) is the mean shortfall in income or consumption from the poverty line $3.20 a day (counting the nonpoor as having zero shortfall), expressed as a percentage of the poverty line. This measure reflects the depth of poverty as well as its incidence.","World Bank, Development Research Group. Data are based on primary household survey data obtained from government statistical agencies and World Bank country departments. Data for high-income economies are from the Luxembourg Income Study database. For more information and methodology, please see PovcalNet (http://iresearch.worldbank.org/PovcalNet/index.htm).",
SI.POV.MDIM,Multidimensional poverty headcount ratio (% of total population),NA,The percentage of people who are multidimensionally poor,Government statistical agencies. Data for EU countires are from the EUROSTAT,
SI.POV.MDIM.17,"Multidimensional poverty headcount ratio, children (% of population ages 0-17)",NA,The percentage of children who are multidimensionally poor,Government statistical agencies. Data for EU countires are from the EUROSTAT,
SI.POV.MDIM.17.XQ,"Multidimensional poverty index, children (population ages 0-17) (scale 0-1)",NA,Proportion of the child population that is multidimensionally poor adjusted by the intensity of the deprivations,Government statistical agencies. Data for EU countires are from the EUROSTAT,
SI.POV.MDIM.FE,"Multidimensional poverty headcount ratio, female (% of female population)",NA,The percentage of female population who are multidimensionally poor,Government statistical agencies. Data for EU countires are from the EUROSTAT,
SI.POV.MDIM.HH,"Multidimensional poverty headcount ratio, household (% of total households)",NA,The percentage of households who are multidimensionally poor,Government statistical agencies. Data for EU countires are from the EUROSTAT,
SI.POV.MDIM.IT,Multidimensional poverty intensity (average share of deprivations experienced by the poor),NA,The average percentage of dimensions in which poor people are deprived,Government statistical agencies. Data for EU countires are from the EUROSTAT,
SI.POV.MDIM.MA,"Multidimensional poverty headcount ratio, male (% of male population)",NA,The percentage of male population who are multidimensionally poor,Government statistical agencies. Data for EU countires are from the EUROSTAT,
SI.POV.MDIM.XQ,Multidimensional poverty index (scale 0-1),NA,Proportion of the population that is multidimensionally poor adjusted by the intensity of the deprivations,Government statistical agencies. Data for EU countires are from the EUROSTAT,
SI.POV.NAHC,Poverty headcount ratio at national poverty lines (% of population),NA,"National poverty headcount ratio is the percentage of the population living below the national poverty line(s). National estimates are based on population-weighted subgroup estimates from household surveys. For economies for which the data are from EU-SILC, the reported year is the income reference year, which is the year before the survey year.","World Bank, Global Poverty Working Group. Data are compiled from official government sources or are computed by World Bank staff using national (i.e. country–specific) poverty lines.",
SI.POV.UMIC,Poverty headcount ratio at $5.50 a day (2011 PPP) (% of population),NA,"Poverty headcount ratio at $5.50 a day is the percentage of the population living on less than $5.50 a day at 2011 international prices. As a result of revisions in PPP exchange rates, poverty rates for individual countries cannot be compared with poverty rates reported in earlier editions.","World Bank, Development Research Group. Data are based on primary household survey data obtained from government statistical agencies and World Bank country departments. Data for high-income economies are from the Luxembourg Income Study database. For more information and methodology, please see PovcalNet (http://iresearch.worldbank.org/PovcalNet/index.htm).",
SI.POV.UMIC.GP,Poverty gap at $5.50 a day (2011 PPP) (%),NA,"Poverty gap at $5.50 a day (2011 PPP) is the mean shortfall in income or consumption from the poverty line $5.50 a day (counting the nonpoor as having zero shortfall), expressed as a percentage of the poverty line. This measure reflects the depth of poverty as well as its incidence.","World Bank, Development Research Group. Data are based on primary household survey data obtained from government statistical agencies and World Bank country departments. Data for high-income economies are from the Luxembourg Income Study database. For more information and methodology, please see PovcalNet (http://iresearch.worldbank.org/PovcalNet/index.htm).",
SL.EMP.1524.SP.ZS,"Employment to population ratio, ages 15-24, total (%) (modeled ILO estimate)",NA,"Employment to population ratio is the proportion of a country's population that is employed. Employment is defined as persons of working age who, during a short reference period, were engaged in any activity to produce goods or provide services for pay or profit, whether at work during the reference period (i.e. who worked in a job for at least one hour) or not at work due to temporary absence from a job, or to working-time arrangements. Ages 15-24 are generally considered the youth population.","International Labour Organization, ILOSTAT database. Data retrieved on June 15, 2021.",
SL.EMP.MPYR.ZS,"Employers, total (% of total employment) (modeled ILO estimate)",NA,"Employers are those workers who, working on their own account or with one or a few partners, hold the type of jobs defined as a ""self-employment jobs"" i.e. jobs where the remuneration is directly dependent upon the profits derived from the goods and services produced), and, in this capacity, have engaged, on a continuous basis, one or more persons to work for them as employee(s).","International Labour Organization, ILOSTAT database. Data retrieved on January 29, 2021.",
SL.EMP.SELF.ZS,"Self-employed, total (% of total employment) (modeled ILO estimate)",NA,"Self-employed workers are those workers who, working on their own account or with one or a few partners or in cooperative, hold the type of jobs defined as a ""self-employment jobs."" i.e. jobs where the remuneration is directly dependent upon the profits derived from the goods and services produced. Self-employed workers include four sub-categories of employers, own-account workers, members of producers' cooperatives, and contributing family workers.","International Labour Organization, ILOSTAT database. Data retrieved on January 29, 2021.",
SL.EMP.TOTL.SP.ZS,"Employment to population ratio, 15+, total (%) (modeled ILO estimate)",NA,"Employment to population ratio is the proportion of a country's population that is employed. Employment is defined as persons of working age who, during a short reference period, were engaged in any activity to produce goods or provide services for pay or profit, whether at work during the reference period (i.e. who worked in a job for at least one hour) or not at work due to temporary absence from a job, or to working-time arrangements. Ages 15 and older are generally considered the working-age population.","International Labour Organization, ILOSTAT database. Data retrieved on June 15, 2021.",
SL.EMP.VULN.ZS,"Vulnerable employment, total (% of total employment) (modeled ILO estimate)",NA,Vulnerable employment is contributing family workers and own-account workers as a percentage of total employment.,"Derived using data from International Labour Organization, ILOSTAT database. The data retrieved on January 29, 2021.",
SL.EMP.WORK.ZS,"Wage and salaried workers, total (% of total employment) (modeled ILO estimate)",NA,"Wage and salaried workers (employees) are those workers who hold the type of jobs defined as ""paid employment jobs,"" where the incumbents hold explicit (written or oral) or implicit employment contracts that give them a basic remuneration that is not directly dependent upon the revenue of the unit for which they work.","International Labour Organization, ILOSTAT database. Data retrieved on January 29, 2021.",
SL.FAM.WORK.ZS,"Contributing family workers, total (% of total employment) (modeled ILO estimate)",NA,"Contributing family workers are those workers who hold ""self-employment jobs"" as own-account workers in a market-oriented establishment operated by a related person living in the same household.","International Labour Organization, ILOSTAT database. Data retrieved on January 29, 2021.",
SL.IND.EMPL.ZS,Employment in industry (% of total employment) (modeled ILO estimate),NA,"Employment is defined as persons of working age who were engaged in any activity to produce goods or provide services for pay or profit, whether at work during the reference period or not at work due to temporary absence from a job, or to working-time arrangement. The industry sector consists of mining and quarrying, manufacturing, construction, and public utilities (electricity, gas, and water), in accordance with divisions 2-5 (ISIC 2) or categories C-F (ISIC 3) or categories B-F (ISIC 4).","International Labour Organization, ILOSTAT database. Data retrieved on January 29, 2021.",
SL.SRV.EMPL.ZS,Employment in services (% of total employment) (modeled ILO estimate),NA,"Employment is defined as persons of working age who were engaged in any activity to produce goods or provide services for pay or profit, whether at work during the reference period or not at work due to temporary absence from a job, or to working-time arrangement. The services sector consists of wholesale and retail trade and restaurants and hotels; transport, storage, and communications; financing, insurance, real estate, and business services; and community, social, and personal services, in accordance with divisions 6-9 (ISIC 2) or categories G-Q (ISIC 3) or categories G-U (ISIC 4).","International Labour Organization, ILOSTAT database. Data retrieved on January 29, 2021.",
SL.TLF.ACTI.1524.ZS,"Labor force participation rate for ages 15-24, total (%) (modeled ILO estimate)",NA,Labor force participation rate for ages 15-24 is the proportion of the population ages 15-24 that is economically active: all people who supply labor for the production of goods and services during a specified period.,"International Labour Organization, ILOSTAT database. Data retrieved on June 15, 2021.",
SL.TLF.ACTI.ZS,"Labor force participation rate, total (% of total population ages 15-64) (modeled ILO estimate)",NA,Labor force participation rate is the proportion of the population ages 15-64 that is economically active: all people who supply labor for the production of goods and services during a specified period.,"International Labour Organization, ILOSTAT database. Data retrieved on June 15, 2021.",
SL.TLF.CACT.ZS,"Labor force participation rate, total (% of total population ages 15+) (modeled ILO estimate)",NA,Labor force participation rate is the proportion of the population ages 15 and older that is economically active: all people who supply labor for the production of goods and services during a specified period.,"International Labour Organization, ILOSTAT database. Data retrieved on June 15, 2021.",
SL.TLF.PART.ZS,"Part time employment, total (% of total employment)",NA,Part time employment refers to regular employment in which working time is substantially less than normal. Definitions of part time employment differ by country.,"International Labour Organization, ILOSTAT database. Data retrieved on January 29, 2021.",
SL.TLF.TOTL.IN,"Labor force, total",NA,"Labor force comprises people ages 15 and older who supply labor for the production of goods and services during a specified period. It includes people who are currently employed and people who are unemployed but seeking work as well as first-time job-seekers. Not everyone who works is included, however. Unpaid workers, family workers, and students are often omitted, and some countries do not count members of the armed forces. Labor force size tends to vary during the year as seasonal workers enter and leave.","Derived using data from International Labour Organization, ILOSTAT database. The data retrieved on June 15, 2021.",
SL.UEM.1524.ZS,"Unemployment, youth total (% of total labor force ages 15-24) (modeled ILO estimate)",NA,Youth unemployment refers to the share of the labor force ages 15-24 without work but available for and seeking employment.,"International Labour Organization, ILOSTAT database. Data retrieved on June 15, 2021.",
SL.UEM.TOTL.NE.ZS,"Unemployment, total (% of total labor force) (national estimate)",NA,Unemployment refers to the share of the labor force that is without work but available for and seeking employment. Definitions of labor force and unemployment differ by country.,"International Labour Organization, ILOSTAT database. Data retrieved on June 15, 2021.",
SL.UEM.TOTL.ZS,"Unemployment, total (% of total labor force) (modeled ILO estimate)",NA,Unemployment refers to the share of the labor force that is without work but available for and seeking employment.,"International Labour Organization, ILOSTAT database. Data retrieved on June 15, 2021.",
