indicator_id,indicator,unit,indicator_desc,source_org,
AG.LND.FRST.ZS,Forest area (% of land area),NA,"Forest area is land under natural or planted stands of trees of at least 5 meters in situ, whether productive or not, and excludes tree stands in agricultural production systems (for example, in fruit plantations and agroforestry systems) and trees in urban parks and gardens.","Food and Agriculture Organization, electronic files and web site.",
AG.LND.TOTL.K2,Land area (sq. km),NA,"Land area is a country's total area, excluding area under inland water bodies, national claims to continental shelf, and exclusive economic zones. In most cases the definition of inland water bodies includes major rivers and lakes.","Food and Agriculture Organization, electronic files and web site.",
AG.LND.TOTL.RU.K2,Rural land area (sq. km),NA,"Rural land area in square kilometers, derived from urban extent grids which distinguish urban and rural areas based on a combination of population counts (persons), settlement points, and the presence of Nighttime Lights. Areas are defined as urban where contiguous lighted cells from the Nighttime Lights or approximated urban extents based on buffered settlement points for which the total population is greater than 5,000 persons.","Center for International Earth Science Information Network (CIESIN)/Columbia University. 2013. Urban-Rural Population and Land Area Estimates Version 2. Palisades, NY: NASA Socioeconomic Data and Applications Center (SEDAC). http://sedac.ciesin.columbia.edu/data/set/lecz-urban-rural-population-land-area-estimates-v2.",
AG.LND.TOTL.UR.K2,Urban land area (sq. km),NA,"Urban land area in square kilometers, based on a combination of population counts (persons), settlement points, and the presence of Nighttime Lights. Areas are defined as urban where contiguous lighted cells from the Nighttime Lights or approximated urban extents based on buffered settlement points for which the total population is greater than 5,000 persons.","Center for International Earth Science Information Network (CIESIN)/Columbia University. 2013. Urban-Rural Population and Land Area Estimates Version 2. Palisades, NY: NASA Socioeconomic Data and Applications Center (SEDAC). http://sedac.ciesin.columbia.edu/data/set/lecz-urban-rural-population-land-area-estimates-v2.",
AG.SRF.TOTL.K2,Surface area (sq. km),NA,"Surface area is a country's total area, including areas under inland bodies of water and some coastal waterways.","Food and Agriculture Organization, electronic files and web site.",
BG.GSR.NFSV.GD.ZS,Trade in services (% of GDP),NA,"Trade in services is the sum of service exports and imports divided by the value of GDP, all in current U.S. dollars.","International Monetary Fund, Balance of Payments Statistics Yearbook and data files, and World Bank and OECD GDP estimates.",
BM.GSR.CMCP.ZS,"Communications, computer, etc. (% of service imports, BoP)",NA,"Communications, computer, information, and other services cover international telecommunications; computer data; news-related service transactions between residents and nonresidents; construction services; royalties and license fees; miscellaneous business, professional, and technical services; personal, cultural, and recreational services; manufacturing services on physical inputs owned by others; and maintenance and repair services and government services not included elsewhere.","International Monetary Fund, Balance of Payments Statistics Yearbook and data files.",
BM.GSR.FCTY.CD,"Primary income payments (BoP, current US$)",NA,"Primary income payments refer to employee compensation paid to nonresident workers and investment income (payments on direct investment, portfolio investment, other investments). Data are in current U.S. dollars.","International Monetary Fund, Balance of Payments Statistics Yearbook and data files.",
BM.GSR.GNFS.CD,"Imports of goods and services (BoP, current US$)",NA,"Imports of goods and services comprise all transactions between residents of a country and the rest of the world involving a change of ownership from nonresidents to residents of general merchandise, nonmonetary gold, and services. Data are in current U.S. dollars.","International Monetary Fund, Balance of Payments Statistics Yearbook and data files.",
BM.GSR.MRCH.CD,"Goods imports (BoP, current US$)",NA,Goods imports refer to all movable goods (including nonmonetary gold) involved in a change of ownership from nonresidents to residents. Data are in current U.S. dollars.,"International Monetary Fund, Balance of Payments Statistics Yearbook and data files.",
BM.GSR.NFSV.CD,"Service imports (BoP, current US$)",NA,"Services refer to economic output of intangible commodities that may be produced, transferred, and consumed at the same time. Data are in current U.S. dollars.","International Monetary Fund, Balance of Payments Statistics Yearbook and data files.",
BM.GSR.TOTL.CD,"Imports of goods, services and primary income (BoP, current US$)",NA,"Imports of goods, services and primary income is the sum of goods imports, service imports and primary income payments. Data are in current U.S. dollars.","International Monetary Fund, Balance of Payments Statistics Yearbook and data files.",
BM.KLT.DINV.CD.WD,"Foreign direct investment, net outflows (BoP, current US$)",NA,"Foreign direct investment refers to direct investment equity flows in an economy. It is the sum of equity capital, reinvestment of earnings, and other capital. Direct investment is a category of cross-border investment associated with a resident in one economy having control or a significant degree of influence on the management of an enterprise that is resident in another economy. Ownership of 10 percent or more of the ordinary shares of voting stock is the criterion for determining the existence of a direct investment relationship. This series shows net outflows of investment from the reporting economy to the rest of the world. Data are in current U.S. dollars.","International Monetary Fund, Balance of Payments database, supplemented by data from the United Nations Conference on Trade and Development and official national sources.",
BM.KLT.DINV.WD.GD.ZS,"Foreign direct investment, net outflows (% of GDP)",NA,"Foreign direct investment refers to direct investment equity flows in an economy. It is the sum of equity capital, reinvestment of earnings, and other capital. Direct investment is a category of cross-border investment associated with a resident in one economy having control or a significant degree of influence on the management of an enterprise that is resident in another economy. Ownership of 10 percent or more of the ordinary shares of voting stock is the criterion for determining the existence of a direct investment relationship. This series shows net outflows of investment from the reporting economy to the rest of the world, and is divided by GDP.","International Monetary Fund, Balance of Payments database, supplemented by data from the United Nations Conference on Trade and Development and official national sources.",
BM.TRF.PRVT.CD,"Secondary income, other sectors, payments (BoP, current US$)",NA,"Secondary income refers to transfers recorded in the balance of payments whenever an economy provides or receives goods, services, income, or financial items without a quid pro quo. All transfers not considered to be capital are current. Data are in current U.S. dollars.","International Monetary Fund, Balance of Payments Statistics Yearbook and data files.",
BM.TRF.PWKR.CD.DT,"Personal remittances, paid (current US$)",NA,"Personal remittances comprise personal transfers and compensation of employees. Personal transfers consist of all current transfers in cash or in kind made or received by resident households to or from nonresident households. Personal transfers thus include all current transfers between resident and nonresident individuals. Compensation of employees refers to the income of border, seasonal, and other short-term workers who are employed in an economy where they are not resident and of residents employed by nonresident entities. Data are the sum of two items defined in the sixth edition of the IMF's Balance of Payments Manual: personal transfers and compensation of employees. Data are in current U.S. dollars.",World Bank staff estimates based on IMF balance of payments data.,
BN.CAB.XOKA.CD,"Current account balance (BoP, current US$)",NA,"Current account balance is the sum of net exports of goods and services, net primary income, and net secondary income. Data are in current U.S. dollars.","International Monetary Fund, Balance of Payments Statistics Yearbook and data files.",
BN.CAB.XOKA.GD.ZS,Current account balance (% of GDP),NA,"Current account balance is the sum of net exports of goods and services, net primary income, and net secondary income.","International Monetary Fund, Balance of Payments Statistics Yearbook and data files, and World Bank and OECD GDP estimates.",
BN.FIN.TOTL.CD,"Net financial account (BoP, current US$)",NA,"The net financial account shows net acquisition and disposal of financial assets and liabilities. It measures how net lending to or borrowing from nonresidents is financed, and is conceptually equal to the sum of the balances on the current and capital accounts. Data are in current U.S. dollars.","International Monetary Fund, Balance of Payments Statistics Yearbook and data files.",
BN.GSR.FCTY.CD,"Net primary income (BoP, current US$)",NA,"Net primary income refers to receipts and payments of employee compensation paid to nonresident workers and investment income (receipts and payments on direct investment, portfolio investment, other investments, and receipts on reserve assets). Data are in current U.S. dollars.","International Monetary Fund, Balance of Payments Statistics Yearbook and data files.",
BN.GSR.GNFS.CD,"Net trade in goods and services (BoP, current US$)",NA,Net trade in goods and services is derived by offsetting imports of goods and services against exports of goods and services. Exports and imports of goods and services comprise all transactions involving a change of ownership of goods and services between residents of one country and the rest of the world. Data are in current U.S. dollars.,"International Monetary Fund, Balance of Payments Statistics Yearbook and data files.",
BN.GSR.MRCH.CD,"Net trade in goods (BoP, current US$)",NA,Net trade in goods is the difference between exports and imports of goods. Trade in services is not included. Data are in current U.S. dollars.,"International Monetary Fund, Balance of Payments Statistics Yearbook and data files.",
BN.KAC.EOMS.CD,"Net errors and omissions (BoP, current US$)",NA,Net errors and omissions constitute a residual category needed to ensure that accounts in the balance of payments statement sum to zero. Net errors and omissions are derived as the balance on the financial account minus the balances on the current and capital accounts. Data are in current U.S. dollars.,"International Monetary Fund, Balance of Payments Statistics Yearbook and data files.",
BN.KLT.DINV.CD,"Foreign direct investment, net (BoP, current US$)",NA,"Foreign direct investment are the net inflows of investment to acquire a lasting management interest (10 percent or more of voting stock) in an enterprise operating in an economy other than that of the investor. It is the sum of equity capital, reinvestment of earnings, other long-term capital, and short-term capital as shown in the balance of payments. This series shows total net FDI. In BPM6, financial account balances are calculated as the change in assets minus the change in liabilities. Net FDI outflows are assets and net FDI inflows are liabilities. Data are in current U.S. dollars.","International Monetary Fund, Balance of Payments Statistics Yearbook and data files.",
BN.RES.INCL.CD,"Reserves and related items (BoP, current US$)",NA,"Reserves and related items is the net change in a country's holdings of international reserves resulting from transactions on the current, capital, and financial accounts. Reserve assets are those external assets that are readily available to and controlled by monetary authorities for meeting balance of payments financing needs, and include holdings of monetary gold, special drawing rights (SDRs), reserve position in the International Monetary Fund (IMF), and other reserve assets. Also included are net credit and loans from the IMF (excluding reserve position) and total exceptional financing. Data are in current U.S. dollars.","International Monetary Fund, Balance of Payments Statistics Yearbook and data files.",
BN.TRF.CURR.CD,"Net secondary income (BoP, current US$)",NA,"Secondary income refers to transfers recorded in the balance of payments whenever an economy provides or receives goods, services, income, or financial items without a quid pro quo. All transfers not considered to be capital are current. Data are in current U.S. dollars.","International Monetary Fund, Balance of Payments Statistics Yearbook and data files.",
BN.TRF.KOGT.CD,"Net capital account (BoP, current US$)",NA,"Net capital account records acquisitions and disposals of nonproduced nonfinancial assets, such as land sold to embassies and sales of leases and licenses, as well as capital transfers, including government debt forgiveness. The use of the term capital account in this context is designed to be consistent with the System of National Accounts, which distinguishes between capital transactions and financial transactions. Data are in current U.S. dollars.","International Monetary Fund, Balance of Payments Statistics Yearbook and data files.",
BX.GSR.GNFS.CD,"Exports of goods and services (BoP, current US$)",NA,"Exports of goods and services comprise all transactions between residents of a country and the rest of the world involving a change of ownership from residents to nonresidents of general merchandise, net exports of goods under merchanting, nonmonetary gold, and services. Data are in current U.S. dollars.","International Monetary Fund, Balance of Payments Statistics Yearbook and data files.",
BX.GSR.MRCH.CD,"Goods exports (BoP, current US$)",NA,Goods exports refer to all movable goods (including nonmonetary gold and net exports of goods under merchanting) involved in a change of ownership from residents to nonresidents. Data are in current U.S. dollars.,"International Monetary Fund, Balance of Payments Statistics Yearbook and data files.",
BX.GSR.NFSV.CD,"Service exports (BoP, current US$)",NA,"Services refer to economic output of intangible commodities that may be produced, transferred, and consumed at the same time. Data are in current U.S. dollars.","International Monetary Fund, Balance of Payments Statistics Yearbook and data files.",
BX.GSR.TOTL.CD,"Exports of goods, services and primary income (BoP, current US$)",NA,"Exports of goods, services and primary income is the sum of goods exports, service exports and primary income receipts. Data are in current U.S. dollars.","International Monetary Fund, Balance of Payments Statistics Yearbook and data files.",
BX.KLT.DINV.CD.WD,"Foreign direct investment, net inflows (BoP, current US$)",NA,"Foreign direct investment refers to direct investment equity flows in the reporting economy. It is the sum of equity capital, reinvestment of earnings, and other capital. Direct investment is a category of cross-border investment associated with a resident in one economy having control or a significant degree of influence on the management of an enterprise that is resident in another economy. Ownership of 10 percent or more of the ordinary shares of voting stock is the criterion for determining the existence of a direct investment relationship. Data are in current U.S. dollars.","International Monetary Fund, Balance of Payments database, supplemented by data from the United Nations Conference on Trade and Development and official national sources.",
BX.KLT.DINV.WD.GD.ZS,"Foreign direct investment, net inflows (% of GDP)",NA,"Foreign direct investment are the net inflows of investment to acquire a lasting management interest (10 percent or more of voting stock) in an enterprise operating in an economy other than that of the investor. It is the sum of equity capital, reinvestment of earnings, other long-term capital, and short-term capital as shown in the balance of payments. This series shows net inflows (new investment inflows less disinvestment) in the reporting economy from foreign investors, and is divided by GDP.","International Monetary Fund, International Financial Statistics and Balance of Payments databases, World Bank, International Debt Statistics, and World Bank and OECD GDP estimates.",
CM.MKT.TRAD.CD,"Stocks traded, total value (current US$)",NA,"The value of shares traded is the total number of shares traded, both domestic and foreign, multiplied by their respective matching prices. Figures are single counted (only one side of the transaction is considered). Companies admitted to listing and admitted to trading are included in the data. Data are end of year values converted to U.S. dollars using corresponding year-end foreign exchange rates.",World Federation of Exchanges database.,
CM.MKT.TRAD.GD.ZS,"Stocks traded, total value (% of GDP)",NA,"The value of shares traded is the total number of shares traded, both domestic and foreign, multiplied by their respective matching prices. Figures are single counted (only one side of the transaction is considered). Companies admitted to listing and admitted to trading are included in the data. Data are end of year values.",World Federation of Exchanges database.,
CM.MKT.TRNR,"Stocks traded, turnover ratio of domestic shares (%)",NA,Turnover ratio is the value of domestic shares traded divided by their market capitalization. The value is annualized by multiplying the monthly average by 12.,World Federation of Exchanges database.,
DC.DAC.TOTL.CD,"Net bilateral aid flows from DAC donors, Total (current US$)",NA,"Net bilateral aid flows from DAC donors are the net disbursements of official development assistance (ODA) or official aid from the members of the Development Assistance Committee (DAC). Net disbursements are gross disbursements of grants and loans minus repayments of principal on earlier loans. ODA consists of loans made on concessional terms (with a grant element of at least 25 percent, calculated at a rate of discount of 10 percent) and grants made to promote economic development and welfare in countries and territories in the DAC list of ODA recipients. Official aid refers to aid flows from official donors to countries and territories in part II of the DAC list of recipients: more advanced countries of Central and Eastern Europe, the countries of the former Soviet Union, and certain advanced developing countries and territories. Official aid is provided under terms and conditions similar to those for ODA. Part II of the DAC List was abolished in 2005. The collection of data on official aid and other resource flows to Part II countries ended with 2004 data. DAC members are Australia, Austria, Belgium, Canada, Czech Republic, Denmark, Finland, France, Germany, Greece, Hungary, Iceland, Ireland, Italy, Japan, Korea, Luxembourg, The Netherlands, New Zealand, Norway, Poland, Portugal, Slovak Republic, Slovienia, Spain, Sweden, Switzerland, United Kingdom, United States, and European Union Institutions. Regional aggregates include data for economies not specified elsewhere. World and income group totals include aid not allocated by country or region. Data are in current U.S. dollars.","Development Assistance Committee of the Organisation for Economic Co-operation and Development, Geographical Distribution of Financial Flows to Developing Countries, Development Co-operation Report, and International Development Statistics database. Data are available online at: https://stats.oecd.org/.",
DC.ODA.TOTL.CD,"Net ODA provided, total (current US$)",NA,Net Official development assistance (ODA) comprises grants or loans to developing countries and territories on the OECD/DAC list of aid recipients that are undertaken by the official sector with promotion of economic development and welfare as the main objective and at concessional financial terms.,"Development Assistance Committee of the Organisation for Economic Co-operation and Development, Geographical Distribution of Financial Flows to Developing Countries, Development Co-operation Report, and International Development Statistics database. Data are available online at: www.oecd.org/dac/stats/idsonline.",
DC.ODA.TOTL.GN.ZS,"Net ODA provided, total (% of GNI)",NA,Net Official development assistance (ODA) comprises grants or loans to developing countries and territories on the OECD/DAC list of aid recipients that are undertaken by the official sector with promotion of economic development and welfare as the main objective and at concessional financial terms. It is shown as a share of donors' GNI.,"Development Assistance Committee of the Organisation for Economic Co-operation and Development, Geographical Distribution of Financial Flows to Developing Countries, Development Co-operation Report, and International Development Statistics database. Data are available online at: www.oecd.org/dac/stats/idsonline.",
DT.DOD.DECT.CD,"External debt stocks, total (DOD, current US$)",NA,"Total external debt is debt owed to nonresidents repayable in currency, goods, or services. Total external debt is the sum of public, publicly guaranteed, and private nonguaranteed long-term debt, use of IMF credit, and short-term debt. Short-term debt includes all debt having an original maturity of one year or less and interest in arrears on long-term debt. Data are in current U.S. dollars.","World Bank, International Debt Statistics.",
DT.DOD.DECT.GN.ZS,External debt stocks (% of GNI),NA,"Total external debt stocks to gross national income. Total external debt is debt owed to nonresidents repayable in currency, goods, or services. Total external debt is the sum of public, publicly guaranteed, and private nonguaranteed long-term debt, use of IMF credit, and short-term debt. Short-term debt includes all debt having an original maturity of one year or less and interest in arrears on long-term debt. GNI (formerly GNP) is the sum of value added by all resident producers plus any product taxes (less subsidies) not included in the valuation of output plus net receipts of primary income (compensation of employees and property income) from abroad.","World Bank, International Debt Statistics.",
DT.DOD.DIMF.CD,"Use of IMF credit (DOD, current US$)",NA,"Use of IMF Credit: Data related to the operations of the IMF are provided by the IMF Treasurer’s Department. They are converted from special drawing rights into dollars using end-of-period exchange rates for stocks and average-over-the-period exchange rates for flows. IMF trust fund operations under the Enhanced Structural Adjustment Facility, Extended Fund Facility, Poverty Reduction and Growth Facility, and Structural Adjustment Facility (Enhanced Structural Adjustment Facility in 1999) are presented together with all of the IMF’s special facilities (buffer stock, supplemental reserve, compensatory and contingency facilities, oil facilities, and other facilities). SDR allocations are also included in this category. According to the BPM6, SDR allocations are recorded as the incurrence of a debt liability of the member receiving them (because of a requirement to repay the allocation in certain circumstances, and also because interest accrues). This debt item is introduced for the first time this year with historical data starting in 1999.","World Bank, International Debt Statistics.",
DT.DOD.DSTC.IR.ZS,Short-term debt (% of total reserves),NA,Short-term debt includes all debt having an original maturity of one year or less and interest in arrears on long-term debt. Total reserves includes gold.,"World Bank, International Debt Statistics.",
DT.DOD.DSTC.XP.ZS,"Short-term debt (% of exports of goods, services and primary income)",NA,Short-term external debt is defined as debt that has an original maturity of one year or less. Available data permit no distinction between public and private nonguaranteed short-term debt.,"World Bank, International Debt Statistics.",
DT.DOD.DSTC.ZS,Short-term debt (% of total external debt),NA,"Short-term debt includes all debt having an original maturity of one year or less and interest in arrears on long-term debt. Total external debt is debt owed to nonresidents repayable in currency, goods, or services. Total external debt is the sum of public, publicly guaranteed, and private nonguaranteed long-term debt, use of IMF credit, and short-term debt.","World Bank, International Debt Statistics.",
DT.DOD.PVLX.CD,Present value of external debt (current US$),NA,"Present value of debt is the sum of short-term external debt plus the discounted sum of total debt service payments due on public, publicly guaranteed, and private nonguaranteed long-term external debt over the life of existing loans. Data are in current U.S. dollars.","World Bank, International Debt Statistics.",
DT.DOD.PVLX.EX.ZS,"Present value of external debt (% of exports of goods, services and primary income)",NA,"Present value of debt is the sum of short-term external debt plus the discounted sum of total debt service payments due on public, publicly guaranteed, and private nonguaranteed long-term external debt over the life of existing loans. The exports denominator is a three-year average.","World Bank, International Debt Statistics.",
