indicator_id,indicator,unit,indicator_desc,source_org,
DT.DOD.PVLX.GN.ZS,Present value of external debt (% of GNI),NA,"Present value of debt is the sum of short-term external debt plus the discounted sum of total debt service payments due on public, publicly guaranteed, and private nonguaranteed long-term external debt over the life of existing loans. The GNI denominator is a three-year average.","World Bank, International Debt Statistics.",
DT.NFL.ILOG.CD,"Net official flows from UN agencies, ILO (current US$)",NA,"Net official flows from UN agencies are the net disbursements of total official flows from the UN agencies. Total official flows are the sum of Official Development Assistance (ODA) or official aid and Other Official Flows (OOF) and represent the total disbursements by the official sector at large to the recipient country. Net disbursements are gross disbursements of grants and loans minus repayments of principal on earlier loans. ODA consists of loans made on concessional terms (with a grant element of at least 25 percent, calculated at a rate of discount of 10 percent) and grants made to promote economic development and welfare in countries and territories in the DAC list of ODA recipients. Official aid refers to aid flows from official donors to countries and territories in part II of the DAC list of recipients: more advanced countries of Central and Eastern Europe, the countries of the former Soviet Union, and certain advanced developing countries and territories. Official aid is provided under terms and conditions similar to those for ODA. Part II of the DAC List was abolished in 2005. The collection of data on official aid and other resource flows to Part II countries ended with 2004 data. OOF are transactions by the official sector whose main objective is other than development-motivated, or, if development-motivated, whose grant element is below the 25 per cent threshold which would make them eligible to be recorded as ODA. The main classes of transactions included here are official export credits, official sector equity and portfolio investment, and debt reorganization undertaken by the official sector at nonconcessional terms (irrespective of the nature or the identity of the original creditor). UN agencies are United Nations includes the United Nations Children’s Fund (UNICEF), United Nations Relief and Works Agency for Palestine Refugees in the Near East (UNRWA), World Food Programme (WFP), International Fund for Agricultural Development (IFAD), United Nations Development Programme(UNDP), United Nations Population Fund (UNFPA), United Nations Refugee Agency (UNHCR), Joint United Nations Programme on HIV/AIDS (UNAIDS), United Nations Regular Programme for Technical Assistance (UNTA), United Nations Peacebuilding Fund (UNPBF), International Atomic Energy Agency (IAEA), World Health Organization (WHO), United Nations Economic Commission for Europe (UNECE), Food and Agriculture Organization of the United Nations (FAO), International Labour Organization (ILO), United Nations Environment Programme (UNEP), World Tourism Organization (UNWTO) and United Nations Institute for Disarmament Research (UNIDIR). Data are in current U.S. dollars.","Development Assistance Committee of the Organisation for Economic Co-operation and Development, Geographical Distribution of Financial Flows to Developing Countries, Development Co-operation Report, and International Development Statistics database. Data are available online at: https://stats.oecd.org/.",
DT.ODA.ALLD.KD,Net official development assistance and official aid received (constant 2018 US$),NA,"Net official development assistance (ODA) consists of disbursements of loans made on concessional terms (net of repayments of principal) and grants by official agencies of the members of the Development Assistance Committee (DAC), by multilateral institutions, and by non-DAC countries to promote economic development and welfare in countries and territories in the DAC list of ODA recipients. It includes loans with a grant element of at least 25 percent (calculated at a rate of discount of 10 percent). Net official aid refers to aid flows (net of repayments) from official donors to countries and territories in part II of the DAC list of recipients: more advanced countries of Central and Eastern Europe, the countries of the former Soviet Union, and certain advanced developing countries and territories. Official aid is provided under terms and conditions similar to those for ODA. Part II of the DAC List was abolished in 2005. The collection of data on official aid and other resource flows to Part II countries ended with 2004 data. Data are in constant 2018 U.S. dollars.","Development Assistance Committee of the Organisation for Economic Co-operation and Development, Geographical Distribution of Financial Flows to Developing Countries, Development Co-operation Report, and International Development Statistics database. Data are available online at: https://stats.oecd.org/.",
DT.ODA.ODAT.GN.ZS,Net ODA received (% of GNI),NA,"Net official development assistance (ODA) consists of disbursements of loans made on concessional terms (net of repayments of principal) and grants by official agencies of the members of the Development Assistance Committee (DAC), by multilateral institutions, and by non-DAC countries to promote economic development and welfare in countries and territories in the DAC list of ODA recipients. It includes loans with a grant element of at least 25 percent (calculated at a rate of discount of 10 percent).","Development Assistance Committee of the Organisation for Economic Co-operation and Development, Geographical Distribution of Financial Flows to Developing Countries, Development Co-operation Report, and International Development Statistics database. Data are available online at: www.oecd.org/dac/stats/idsonline. World Bank GNI estimates are used for the denominator.",
EG.ELC.ACCS.RU.ZS,"Access to electricity, rural (% of rural population)",NA,"Access to electricity, rural is the percentage of rural population with access to electricity.","World Bank Global Electrification Database from ""Tracking SDG 7: The Energy Progress Report"" led jointly by the custodian agencies: the International Energy Agency (IEA), the International Renewable Energy Agency (IRENA), the United Nations Statistics Division (UNSD), the World Bank and the World Health Organization (WHO).",
EG.ELC.ACCS.ZS,Access to electricity (% of population),NA,"Access to electricity is the percentage of population with access to electricity. Electrification data are collected from industry, national surveys and international sources.","World Bank Global Electrification Database from ""Tracking SDG 7: The Energy Progress Report"" led jointly by the custodian agencies: the International Energy Agency (IEA), the International Renewable Energy Agency (IRENA), the United Nations Statistics Division (UNSD), the World Bank and the World Health Organization (WHO).",
EG.GDP.PUSE.KO.PP.KD,GDP per unit of energy use (constant 2017 PPP $ per kg of oil equivalent),NA,GDP per unit of energy use is the PPP GDP per kilogram of oil equivalent of energy use. PPP GDP is gross domestic product converted to 2017 constant international dollars using purchasing power parity rates. An international dollar has the same purchasing power over GDP as a U.S. dollar has in the United States.,"IEA Statistics © OECD/IEA 2014 (http://www.iea.org/stats/index.asp), subject to https://www.iea.org/t&c/termsandconditions/",
EG.USE.ELEC.KH.PC,Electric power consumption (kWh per capita),NA,"Electric power consumption measures the production of power plants and combined heat and power plants less transmission, distribution, and transformation losses and own use by heat and power plants.","IEA Statistics © OECD/IEA 2014 (http://www.iea.org/stats/index.asp), subject to https://www.iea.org/t&c/termsandconditions/",
EN.CLC.DRSK.XQ,Disaster risk reduction progress score (1-5 scale, 5=best),NA,"Disaster risk reduction progress score is an average of self-assessment scores, ranging from 1 to 5, submitted by countries under Priority 1 of the Hyogo Framework National Progress Reports. The Hyogo Framework is a global blueprint for disaster risk reduction efforts that was adopted by 168 countries in 2005. Assessments of ""Priority 1"" include four indicators that reflect the degree to which countries have prioritized disaster risk reduction and the strengthening of relevant institutions.","(UNISDR, 2009-2011 Progress Reports, http://www.preventionweb.net/english/hyogo)."
EN.CLC.MDAT.ZS,"Droughts, floods, extreme temperatures (% of population, average 1990-2009)",NA,"Droughts, floods and extreme temperatures is the annual average percentage of the population that is affected by natural disasters classified as either droughts, floods, or extreme temperature events. A drought is an extended period of time characterized by a deficiency in a region's water supply that is the result of constantly below average precipitation. A drought can lead to losses to agriculture, affect inland navigation and hydropower plants, and cause a lack of drinking water and famine. A flood is a significant rise of water level in a stream, lake, reservoir or coastal region. Extreme temperature events are either cold waves or heat waves. A cold wave can be both a prolonged period of excessively cold weather and the sudden invasion of very cold air over a large area. Along with frost it can cause damage to agriculture, infrastructure, and property. A heat wave is a prolonged period of excessively hot and sometimes also humid weather relative to normal climate patterns of a certain region. Population affected is the number of people injured, left homeless or requiring immediate assistance during a period of emergency resulting from a natural disaster; it can also include displaced or evacuated people. Average percentage of population affected is calculated by dividing the sum of total affected for the period stated by the sum of the annual population figures for the period stated.","EM-DAT: The OFDA/CRED International Disaster Database: www.emdat.be, Université Catholique de Louvain, Brussels (Belgium), World Bank.",
EN.POP.DNST,Population density (people per sq. km of land area),NA,"Population density is midyear population divided by land area in square kilometers. Population is based on the de facto definition of population, which counts all residents regardless of legal status or citizenship--except for refugees not permanently settled in the country of asylum, who are generally considered part of the population of their country of origin. Land area is a country's total area, excluding area under inland water bodies, national claims to continental shelf, and exclusive economic zones. In most cases the definition of inland water bodies includes major rivers and lakes.",Food and Agriculture Organization and World Bank population estimates.,
EN.POP.SLUM.UR.ZS,Population living in slums (% of urban population),NA,"Population living in slums is the proportion of the urban population living in slum households. A slum household is defined as a group of individuals living under the same roof lacking one or more of the following conditions: access to improved water, access to improved sanitation, sufficient living area, housing durability, and security of tenure, as adopted in the Millennium Development Goal Target 7.D. The successor, the Sustainable Development Goal 11.1.1, considers inadequate housing (housing affordability) to complement the above definition of slums/informal settlements.",United Nations Human Settlements Programme (UN-HABITAT),
EN.URB.MCTY,Population in urban agglomerations of more than 1 million,NA,Population in urban agglomerations of more than one million is the country's population living in metropolitan areas that in 2018 had a population of more than one million people.,"United Nations, World Urbanization Prospects.",
EN.URB.MCTY.TL.ZS,Population in urban agglomerations of more than 1 million (% of total population),NA,Population in urban agglomerations of more than one million is the percentage of a country's population living in metropolitan areas that in 2018 had a population of more than one million people.,"United Nations, World Urbanization Prospects.",
FM.AST.DOMS.CN,Net domestic credit (current LCU),NA,Net domestic credit is the sum of net claims on the central government and claims on other sectors of the domestic economy (IFS line 32). Data are in current local currency.,"International Monetary Fund, International Financial Statistics and data files.",
FM.AST.NFRG.CN,Net foreign assets (current LCU),NA,"Net foreign assets are the sum of foreign assets held by monetary authorities and deposit money banks, less their foreign liabilities. Data are in current local currency.","International Monetary Fund, International Financial Statistics and data files.",
FP.CPI.TOTL,Consumer price index (2010 = 100),NA,"Consumer price index reflects changes in the cost to the average consumer of acquiring a basket of goods and services that may be fixed or changed at specified intervals, such as yearly. The Laspeyres formula is generally used. Data are period averages.","International Monetary Fund, International Financial Statistics and data files.",
FP.CPI.TOTL.ZG,"Inflation, consumer prices (annual %)",NA,"Inflation as measured by the consumer price index reflects the annual percentage change in the cost to the average consumer of acquiring a basket of goods and services that may be fixed or changed at specified intervals, such as yearly. The Laspeyres formula is generally used.","International Monetary Fund, International Financial Statistics and data files.",
FP.WPI.TOTL,Wholesale price index (2010 = 100),NA,"Wholesale price index refers to a mix of agricultural and industrial goods at various stages of production and distribution, including import duties. The Laspeyres formula is generally used.","International Monetary Fund, International Financial Statistics and data files.",
FR.INR.RINR,Real interest rate (%),NA,"Real interest rate is the lending interest rate adjusted for inflation as measured by the GDP deflator. The terms and conditions attached to lending rates differ by country, however, limiting their comparability.","International Monetary Fund, International Financial Statistics and data files using World Bank data on the GDP deflator.",
GC.DOD.TOTL.CN,"Central government debt, total (current LCU)",NA,"Debt is the entire stock of direct government fixed-term contractual obligations to others outstanding on a particular date. It includes domestic and foreign liabilities such as currency and money deposits, securities other than shares, and loans. It is the gross amount of government liabilities reduced by the amount of equity and financial derivatives held by the government. Because debt is a stock rather than a flow, it is measured as of a given date, usually the last day of the fiscal year.","International Monetary Fund, Government Finance Statistics Yearbook and data files.",
GC.DOD.TOTL.GD.ZS,"Central government debt, total (% of GDP)",NA,"Debt is the entire stock of direct government fixed-term contractual obligations to others outstanding on a particular date. It includes domestic and foreign liabilities such as currency and money deposits, securities other than shares, and loans. It is the gross amount of government liabilities reduced by the amount of equity and financial derivatives held by the government. Because debt is a stock rather than a flow, it is measured as of a given date, usually the last day of the fiscal year.","International Monetary Fund, Government Finance Statistics Yearbook and data files, and World Bank and OECD GDP estimates.",
GC.NLD.TOTL.CN,Net lending (+) / net borrowing (-) (current LCU),NA,"Net lending (+) / net borrowing (–) equals government revenue minus expense, minus net investment in nonfinancial assets. It is also equal to the net result of transactions in financial assets and liabilities. Net lending/net borrowing is a summary measure indicating the extent to which government is either putting financial resources at the disposal of other sectors in the economy or abroad, or utilizing the financial resources generated by other sectors in the economy or from abroad.","International Monetary Fund, Government Finance Statistics Yearbook and data files.",
GC.NLD.TOTL.GD.ZS,Net lending (+) / net borrowing (-) (% of GDP),NA,"Net lending (+) / net borrowing (–) equals government revenue minus expense, minus net investment in nonfinancial assets. It is also equal to the net result of transactions in financial assets and liabilities. Net lending/net borrowing is a summary measure indicating the extent to which government is either putting financial resources at the disposal of other sectors in the economy or abroad, or utilizing the financial resources generated by other sectors in the economy or from abroad.","International Monetary Fund, Government Finance Statistics Yearbook and data files.",
GC.REV.GOTR.CN,Grants and other revenue (current LCU),NA,"Grants and other revenue include grants from other foreign governments, international organizations, and other government units; interest; dividends; rent; requited, nonrepayable receipts for public purposes (such as fines, administrative fees, and entrepreneurial income from government owner­ship of property); and voluntary, unrequited, nonrepayable receipts other than grants.","International Monetary Fund, Government Finance Statistics Yearbook and data files.",
GC.REV.GOTR.ZS,Grants and other revenue (% of revenue),NA,"Grants and other revenue include grants from other foreign governments, international organizations, and other government units; interest; dividends; rent; requited, nonrepayable receipts for public purposes (such as fines, administrative fees, and entrepreneurial income from government owner­ship of property); and voluntary, unrequited, nonrepayable receipts other than grants.","International Monetary Fund, Government Finance Statistics Yearbook and data files.",
GC.REV.SOCL.CN,Social contributions (current LCU),NA,"Social contributions include social security contributions by employees, employers, and self-employed individuals, and other contributions whose source cannot be determined. They also include actual or imputed contributions to social insurance schemes operated by governments.","International Monetary Fund, Government Finance Statistics Yearbook and data files.",
GC.REV.SOCL.ZS,Social contributions (% of revenue),NA,"Social contributions include social security contributions by employees, employers, and self-employed individuals, and other contributions whose source cannot be determined. They also include actual or imputed contributions to social insurance schemes operated by governments.","International Monetary Fund, Government Finance Statistics Yearbook and data files.",
GC.XPN.TRFT.CN,Subsidies and other transfers (current LCU),NA,"Subsidies, grants, and other social benefits include all unrequited, nonrepayable transfers on current account to private and public enterprises; grants to foreign governments, international organizations, and other government units; and social security, social assistance benefits, and employer social benefits in cash and in kind.","International Monetary Fund, Government Finance Statistics Yearbook and data files.",
GC.XPN.TRFT.ZS,Subsidies and other transfers (% of expense),NA,"Subsidies, grants, and other social benefits include all unrequited, nonrepayable transfers on current account to private and public enterprises; grants to foreign governments, international organizations, and other government units; and social security, social assistance benefits, and employer social benefits in cash and in kind.","International Monetary Fund, Government Finance Statistics Yearbook and data files.",
IC.ELC.OUTG.ZS,Firms experiencing electrical outages (% of firms),NA,Percent of firms experiencing electrical outages during the previous fiscal year.,"World Bank, Enterprise Surveys (http://www.enterprisesurveys.org/).",
IC.FRM.BRIB.ZS,Bribery incidence (% of firms experiencing at least one bribe payment request),NA,"Bribery incidence is the percentage of firms experiencing at least one bribe payment request across 6 public transactions dealing with utilities access, permits, licenses, and taxes.","World Bank, Enterprise Surveys (http://www.enterprisesurveys.org/).",
IC.FRM.CRIM.ZS,Losses due to theft and vandalism (% of annual sales of affected firms),NA,"Average losses as a result of theft, robbery, vandalism or arson that occurred on the establishment’s premises calculated as a percentage of annual sales. The value represents the average losses for all firms which reported losses (please see indicator IC.FRM.THEV.ZS).","World Bank, Enterprise Surveys (http://www.enterprisesurveys.org/).",
IQ.CPA.GNDR.XQ,CPIA gender equality rating (1=low to 6=high),NA,"Gender equality assesses the extent to which the country has installed institutions and programs to enforce laws and policies that promote equal access for men and women in education, health, the economy, and protection under law.","World Bank Group, CPIA database (http://www.worldbank.org/ida).",
IQ.CPA.PADM.XQ,CPIA quality of public administration rating (1=low to 6=high),NA,Quality of public administration assesses the extent to which civilian central government staff is structured to design and implement government policy and deliver services effectively.,"World Bank Group, CPIA database (http://www.worldbank.org/ida).",
IQ.CPA.PRES.XQ,CPIA equity of public resource use rating (1=low to 6=high),NA,Equity of public resource use assesses the extent to which the pattern of public expenditures and revenue collection affects the poor and is consistent with national poverty reduction priorities.,"World Bank Group, CPIA database (http://www.worldbank.org/ida).",
IQ.CPA.PROP.XQ,CPIA property rights and rule-based governance rating (1=low to 6=high),NA,Property rights and rule-based governance assess the extent to which private economic activity is facilitated by an effective legal system and rule-based governance structure in which property and contract rights are reliably respected and enforced.,"World Bank Group, CPIA database (http://www.worldbank.org/ida).",
IQ.CPA.PROT.XQ,CPIA social protection rating (1=low to 6=high),NA,"Social protection and labor assess government policies in social protection and labor market regulations that reduce the risk of becoming poor, assist those who are poor to better manage further risks, and ensure a minimal level of welfare to all people.","World Bank Group, CPIA database (http://www.worldbank.org/ida).",
IQ.CPA.PUBS.XQ,CPIA public sector management and institutions cluster average (1=low to 6=high),NA,"The public sector management and institutions cluster includes property rights and rule-based governance, quality of budgetary and financial management, efficiency of revenue mobilization, quality of public administration, and transparency, accountability, and corruption in the public sector.","World Bank Group, CPIA database (http://www.worldbank.org/ida).",
IQ.CPA.REVN.XQ,CPIA efficiency of revenue mobilization rating (1=low to 6=high),NA,"Efficiency of revenue mobilization assesses the overall pattern of revenue mobilization--not only the de facto tax structure, but also revenue from all sources as actually collected.","World Bank Group, CPIA database (http://www.worldbank.org/ida).",
IQ.CPA.SOCI.XQ,CPIA policies for social inclusion/equity cluster average (1=low to 6=high),NA,"The policies for social inclusion and equity cluster includes gender equality, equity of public resource use, building human resources, social protection and labor, and policies and institutions for environmental sustainability.","World Bank Group, CPIA database (http://www.worldbank.org/ida).",
IQ.CPA.STRC.XQ,CPIA structural policies cluster average (1=low to 6=high),NA,"The structural policies cluster includes trade, financial sector, and business regulatory environment.","World Bank Group, CPIA database (http://www.worldbank.org/ida).",
IQ.CPA.TRAN.XQ,"CPIA transparency, accountability, and corruption in the public sector rating (1=low to 6=high)",NA,"Transparency, accountability, and corruption in the public sector assess the extent to which the executive can be held accountable for its use of funds and for the results of its actions by the electorate and by the legislature and judiciary, and the extent to which public employees within the executive are required to account for administrative decisions, use of resources, and results obtained. The three main dimensions assessed here are the accountability of the executive to oversight institutions and of public employees for their performance, access of civil society to information on public affairs, and state capture by narrow vested interests.","World Bank Group, CPIA database (http://www.worldbank.org/ida).",
IQ.SCI.MTHD,Methodology assessment of statistical capacity (scale 0 - 100),NA,The methodology indicator measures a country’s ability to adhere to internationally recommended standards and methods. The methodology score is calculated as the weighted average of 10 underlying indicator scores. The final methodology score contributes 1/3 of the overall Statistical Capacity Indicator score.,"World Bank, Bulletin Board on Statistical Capacity (http://bbsc.worldbank.org).",
